{
  "version": "v2.0.4",
  "owner": "uDOS-core",
  "schema": "schemas/budget-policy-contract.schema.json",
  "summary": "Core-owned budget policy contract shape consumed by Wizard for managed provider and MCP routing decisions.",
  "required_fields": [
    "project_id",
    "budget_groups",
    "daily_limits",
    "per_provider_limits",
    "cooldown_windows",
    "approval_gates"
  ],
  "budget_groups": [
    "offline_only",
    "tier0_free",
    "tier1_economy",
    "tier2_premium",
    "tierX_locked"
  ],
  "owners": {
    "contract": "uDOS-core",
    "live_budget_owner": "uDOS-wizard",
    "simulation_owner": "uDOS-dev"
  }
}
